{
  "id": "R-0001",
  "type": "risk",
  "title": "Steering milestone may slip due to unresolved supplier dependency",
  "status": "mitigating",
  "severity": 4,
  "owner": "Sima Bagheri",
  "due_date": "2026-05-15",
  "summary": "Supplier API readiness remains uncertain and could delay the steering package if interface decisions are not closed this week.",
  "impact": "Steering decision and downstream integration planning could slip by one cycle.",
  "mitigation": "Escalate interface decision by Wednesday, confirm fallback scope, and track supplier response daily.",
  "last_updated": "2026-04-26",
  "linked_decision_id": "DM-0001"
}